{
  "schemaVersion": 1,
  "generatedAt": "2000-01-01T00:00:00.000Z",
  "studios": [
    {
      "id": "synthetic-example-studio",
      "name": "Synthetic Example Studio (not real)",
      "officialWebsiteUrl": "https://example.com/synthetic-studio",
      "homeCountryCode": null
    }
  ],
  "routes": [
    {
      "id": "synthetic-example-route",
      "studioId": "synthetic-example-studio",
      "routeUrl": "https://example.com/synthetic-studio/speculative-route",
      "evidenceUrl": "https://example.com/synthetic-studio/speculative-route",
      "routeType": "dedicated-page",
      "status": "candidate",
      "countryScope": "unknown",
      "countryCodes": [],
      "language": "en",
      "disciplineTags": [],
      "workModel": "not-stated",
      "matchedPhraseCategory": "explicit-speculative-application",
      "evidenceSummary": "Synthetic fixture only; it does not assert that any real studio accepts applications.",
      "contentHash": "797d403768dbc58728b981c0cd82fcb525c21bbd132991a44377fabcf267f418",
      "firstSeenAt": "2000-01-01T00:00:00.000Z",
      "lastCheckedAt": "2000-01-02T00:00:00.000Z",
      "lastVerifiedAt": null
    }
  ]
}
